{
  "basis": {
    "decision_sha256": "ee5f6b15fc3727d53c9836b183ed8b53f07a9b0e1a3d6022915f35a87cdd7a1a",
    "state_sha256": "dcb2fa185d706fb58d8cbf37abeccd7b65a5979ffa3f46da9d3072693f961df6",
    "telemetry_sha256": "adf0c601661edb20aaf940114ffc3129bc044c9d305664c50bd3236127f2693a"
  },
  "created_at": "2026-01-10T04:57:04.374317+00:00",
  "items": [
    {
      "action": "noop_maintain_green",
      "expected_effects": {
        "goal": "stability"
      },
      "id": "chg-001",
      "priority": "low",
      "safety_notes": [
        "Keep policy gates intact (Es->Lambda->T).",
        "Do not bypass audit/validators."
      ],
      "suggested_edits": [
        "No code change required.",
        "Only update baselines intentionally if metrics changed for a justified reason.",
        "Ensure CI workflow remains canonical and non-duplicated.",
        "Generate and upload UVLM bundle after merge."
      ],
      "targets": [
        "tests/baselines/*",
        ".github/workflows/ci.yml"
      ],
      "tests_required": [
        "pytest -q python/tests",
        "pytest -q ucc/tests",
        "telemetry smoke in CI"
      ],
      "why": "System is green; maintain baselines and keep telemetry consistent."
    }
  ],
  "notes": "Diff-hints only (proposal-only). No auto-apply.",
  "proposal": {
    "path": "out/telemetry_smoke/change_proposal.json",
    "sha256": "08341bfd7d59f9ae140474f73df20a7b21981720dfd8b3786adce15288f8b3f4"
  },
  "schema_id": "coherencelattice.change_patch_plan.v1",
  "version": 1
}